{
  "artifact": "formation_summary_v0",
  "artifactVersion": "0.1.0",
  "generatedAt": "2026-07-14T01:44:28+00:00",
  "season": 2024,
  "sourceArtifacts": [
    "nflverse-data:pbp/play_by_play_2024"
  ],
  "metadata": {
    "seasonType": "REG",
    "grain": "team_season",
    "denominatorRule": "2024 REG play-by-play rows with non-null posteam and play_type in {pass, run}; two_point_attempt == 1 and aborted_play == 1 rows are excluded null-safely (a null flag is not itself an exclusion). Kneels, spikes, no-plays, penalty-only/no-snap rows, special teams, two-point attempts, and aborted plays are all outside this denominator. This is the team_week_raw_v0 competitivePlays-equivalent (spec section 3.1a), extended with the explicit aborted_play exclusion verified live in #214 (111 aborted rows inside play_type pass/run in the 2024 REG slice).",
    "alignmentVocabulary": [
      "shotgun",
      "non_shotgun",
      "unknown_or_unclassified_alignment"
    ],
    "alignmentRule": "shotgun == 1 -> shotgun; shotgun == 0 -> non_shotgun; null/missing shotgun -> unknown_or_unclassified_alignment. non_shotgun means shotgun-negative only: it may silently include pistol formations if the source does not separately flag them (no pistol-disambiguation field was found in the 2024 source, #214). It is not an under-center claim and must not be read as one. Any other observed shotgun value aborts the build (fail closed).",
    "passRunSplitRule": "Pass vs. run inside each alignment bucket is classified by qb_dropback (1 -> pass, 0 -> run), never by play_type, so valid QB scrambles stay in the pass split (spec section 3.1b). If any qualifying play for a team-season has a null qb_dropback, that row's shotgun/non_shotgun pass/run split fields are null-blocked (fail closed) with a machine-readable sample note.",
    "successDefinition": {
      "name": "tiber_team_state_distance_success",
      "rule": "yards_gained >= 40% of ydstogo on 1st down, >= 60% on 2nd down, >= 100% on 3rd/4th down; a play with null down, ydstogo, or yards_gained counts as not-successful (mirrors fill_null(False) in src/team_state/compute.py).",
      "codeReference": "src/team_state/compute.py (is_success expression)",
      "disclosure": "This is TIBER's existing team_state success definition computed explicitly from down/ydstogo/yards_gained. It is NOT nflverse's native `success` column; that provider-modeled field is not consumed by this artifact (spec section 3.2 anti-drift rule)."
    },
    "epaDisclosure": "epa is nflverse's own modeled advanced stat (provider_model_derived), not a raw NFL measurement. *_epa_per_play averages the non-null epa values on qualifying plays in the alignment bucket and is null-blocked below the declared sample threshold; a missing value is null, never zero.",
    "sampleThresholds": {
      "minOffensivePlaysPerRow": 250,
      "minBucketPlaysForEfficiency": 100,
      "unknownShareUncertaintyThreshold": 0.1
    },
    "provenanceStatus": "candidate_real_data",
    "provenanceNotes": [
      "Candidate-only artifact per TIBER-Data #214: written only under a candidate path, never promoted, and no Teamstate, Fantasy, or Forecast consumer is wired to it.",
      "Alignment vocabulary is exactly shotgun / non_shotgun / unknown_or_unclassified_alignment. non_shotgun is shotgun-negative only and may silently include pistol formations; it is not an under-center claim (spec section 3.3).",
      "111 aborted play(s) (aborted_play == 1) inside play_type {pass, run} were explicitly excluded from the qualifying denominator; a naive play_type-only denominator would have wrongly included them (#214).",
      "135 two-point attempt(s) inside play_type {pass, run} were excluded from the qualifying denominator and tracked separately.",
      "0 team-season row(s) had pass/run split fields null-blocked because one or more qualifying plays had a null qb_dropback (fail closed, spec section 3.1b).",
      "Success rates use TIBER's own team_state down/distance rule computed explicitly; nflverse's native `success` column is not consumed (spec section 3.2).",
      "No governance marker is set by this build. Promotion to governed status requires a separate, explicitly authorized human promotion review; build success and validation passing do not constitute governance.",
      "Each source records a sha256 checksum over the exact bytes consumed. sourceUrlOrDatasetId is a mutable nflverse rolling release asset; no immutable release tag/ref is exposed at retrieval, so immutableSourceRef is not set. The sha256 checksum pins the exact source bytes consumed at retrievalTimestamp so a future rebuild can detect upstream drift; the upstream URL itself remains mutable."
    ],
    "inputSources": [
      {
        "sourceName": "nflverse play-by-play",
        "sourceType": "nflverse",
        "retrievalMethod": "httpx GET https://github.com/nflverse/nflverse-data/releases/download/pbp/play_by_play_2024.parquet (same nflverse release asset as nflreadpy.load_pbp([2024])), parsed via polars.read_parquet, filtered to season_type == 'REG' and season == 2024",
        "retrievalTimestamp": "2026-07-14T01:44:19+00:00",
        "packageVersion": "0.1.5",
        "polarsVersion": "1.42.1",
        "sourceUrlOrDatasetId": "https://github.com/nflverse/nflverse-data/releases/download/pbp/play_by_play_2024.parquet",
        "transformCodePath": "scripts/build_formation_summary_v0_2024_candidate.py",
        "sourceRefs": [
          "nflverse-data:pbp/play_by_play_2024"
        ],
        "checksum": {
          "algorithm": "sha256",
          "value": "6d432dd4308329bfddaef633309ea119f9ca46d52cbb3c09f47172a2e8efcd01"
        },
        "immutableSourceRef": null,
        "mutabilityNote": "sourceUrlOrDatasetId is a mutable nflverse rolling release asset; no immutable release tag/ref is exposed at retrieval, so immutableSourceRef is not set. The sha256 checksum pins the exact source bytes consumed at retrievalTimestamp so a future rebuild can detect upstream drift; the upstream URL itself remains mutable.",
        "buildCommand": "python scripts/build_formation_summary_v0_2024_candidate.py",
        "sourceRowCount": 49492,
        "regularSeasonRowCount": 47274,
        "sourceColumnCount": 372
      }
    ],
    "coverage": {
      "season": 2024,
      "expectedTeams": [
        "ARI",
        "ATL",
        "BAL",
        "BUF",
        "CAR",
        "CHI",
        "CIN",
        "CLE",
        "DAL",
        "DEN",
        "DET",
        "GB",
        "HOU",
        "IND",
        "JAX",
        "KC",
        "LAC",
        "LAR",
        "LV",
        "MIA",
        "MIN",
        "NE",
        "NO",
        "NYG",
        "NYJ",
        "PHI",
        "PIT",
        "SEA",
        "SF",
        "TB",
        "TEN",
        "WAS"
      ],
      "presentTeams": [
        "ARI",
        "ATL",
        "BAL",
        "BUF",
        "CAR",
        "CHI",
        "CIN",
        "CLE",
        "DAL",
        "DEN",
        "DET",
        "GB",
        "HOU",
        "IND",
        "JAX",
        "KC",
        "LAC",
        "LAR",
        "LV",
        "MIA",
        "MIN",
        "NE",
        "NO",
        "NYG",
        "NYJ",
        "PHI",
        "PIT",
        "SEA",
        "SF",
        "TB",
        "TEN",
        "WAS"
      ],
      "missingTeams": [],
      "unexpectedTeams": [],
      "teamsCovered": 32,
      "isFullLeague": true,
      "suppressedTeams": [],
      "missingFields": []
    },
    "governance": {
      "governanceStatus": "ungoverned",
      "governanceSource": "not_set",
      "notes": "No human promotion review has been performed. Build success and validation passing do not constitute governance."
    },
    "suppressedRows": [],
    "blockedFieldRows": {
      "dropbackSplit(shotgun_pass_rate/shotgun_run_rate/non_shotgun_pass_rate/non_shotgun_run_rate)": []
    },
    "buildDiagnostics": {
      "qualifyingPlaysTotal": 33225,
      "abortedPlaysExcludedTotal": 111,
      "twoPointPlaysExcludedTotal": 135,
      "unknownAlignmentPlaysTotal": 0,
      "dropbackSplitBlockedRowCount": 0,
      "suppressedRowCount": 0
    },
    "validationReportPath": "exports\\candidates\\formation_summary\\formation_summary_v0_2024_real_source_candidate.validation.json",
    "lineageManifestPath": "data\\manifests\\formation_summary_v0_2024_real_source_candidate.manifest.json"
  },
  "rows": [
    {
      "season": 2024,
      "grain": "team_season",
      "team": "ARI",
      "offensive_plays": 1022,
      "shotgun_plays": 735,
      "non_shotgun_plays": 287,
      "unknown_or_unclassified_alignment_plays": 0,
      "shotgun_rate": 0.719178,
      "non_shotgun_rate": 0.280822,
      "unknown_alignment_rate": 0.0,
      "shotgun_pass_rate": 0.689796,
      "shotgun_run_rate": 0.310204,
      "non_shotgun_pass_rate": 0.369338,
      "non_shotgun_run_rate": 0.630662,
      "two_point_plays": 5,
      "aborted_plays_excluded": 4,
      "shotgun_epa_per_play": 0.11444,
      "shotgun_success_rate": 0.537415,
      "non_shotgun_epa_per_play": -0.007926,
      "non_shotgun_success_rate": 0.498258,
      "unknown_alignment_uncertainty_flag": false,
      "sample_notes": [],
      "sourceRefs": [
        "nflverse-data:pbp/play_by_play_2024"
      ],
      "provenanceStatus": "candidate_source_backed_not_promoted"
    },
    {
      "season": 2024,
      "grain": "team_season",
      "team": "ATL",
      "offensive_plays": 1061,
      "shotgun_plays": 872,
      "non_shotgun_plays": 189,
      "unknown_or_unclassified_alignment_plays": 0,
      "shotgun_rate": 0.821866,
      "non_shotgun_rate": 0.178134,
      "unknown_alignment_rate": 0.0,
      "shotgun_pass_rate": 0.626147,
      "shotgun_run_rate": 0.373853,
      "non_shotgun_pass_rate": 0.253968,
      "non_shotgun_run_rate": 0.746032,
      "two_point_plays": 4,
      "aborted_plays_excluded": 8,
      "shotgun_epa_per_play": 0.060052,
      "shotgun_success_rate": 0.513761,